{
  "$schema": "https://json-schema.org/draft/2020-12/schema",
  "$id": "https://github.com/Relational-Relativity-Corporation/abr-irrs/eval/schemas/declaration.schema.json",
  "title": "IRRS Declaration",
  "description": "Declaration document supplied to irrs-eval. Describes the inputs, regional prerequisite, and authorized mappings for a problem space. irrs-eval reads this file; no domain-specific Rust code is required.",
  "type": "object",
  "required": ["domain", "topology_id", "version", "inputs", "regional_prerequisite", "mappings"],
  "additionalProperties": false,

  "properties": {
    "domain": {
      "type": "string",
      "description": "Domain identifier, e.g. 'datafeel'.",
      "minLength": 1
    },

    "topology_id": {
      "type": "string",
      "description": "Topology identifier matching the one declared in the relational gate, e.g. 'circadian_v1'.",
      "minLength": 1
    },

    "version": {
      "type": "string",
      "description": "Semantic version of the application declaring this topology.",
      "pattern": "^[0-9]+\\.[0-9]+\\.[0-9]+"
    },

    "description": {
      "type": ["string", "null"],
      "description": "Optional human-readable description of the problem space."
    },

    "inputs": {
      "type": "array",
      "description": "Every input value involved in the declared problem space. Includes values submitted to the gate AND values the gate produces.",
      "minItems": 1,
      "items": { "$ref": "#/$defs/InputDeclaration" }
    },

    "regional_prerequisite": {
      "$ref": "#/$defs/RegionalPrerequisiteDecl"
    },

    "mappings": {
      "type": "array",
      "description": "Every authorized mapping that may be applied by the gate.",
      "minItems": 1,
      "items": { "$ref": "#/$defs/MappingDeclaration" }
    }
  },

  "$defs": {
    "InputDeclaration": {
      "type": "object",
      "description": "Declaration of a single input value in the problem space.",
      "required": [
        "name",
        "classification",
        "source_identity",
        "acquisition_method",
        "relationship_to_problem",
        "provenance_status",
        "submitted_to_gate"
      ],
      "additionalProperties": false,
      "properties": {
        "name": {
          "type": "string",
          "description": "Short identifier matching the name used in mapping descriptions.",
          "minLength": 1
        },
        "classification": {
          "$ref": "#/$defs/InputClassification"
        },
        "source_identity": {
          "type": "string",
          "description": "Identity of the system, sensor, configuration file, or process that provides or generates this value.",
          "minLength": 1
        },
        "acquisition_method": {
          "type": "string",
          "description": "How this value is acquired or generated.",
          "minLength": 1
        },
        "transformation_history": {
          "type": ["string", "null"],
          "description": "Sequence of transformations applied before this value reaches the gate, if any."
        },
        "relationship_to_problem": {
          "type": "string",
          "description": "Plain-language statement of how this value relates to the declared problem space.",
          "minLength": 1
        },
        "supporting_evidence": {
          "type": "array",
          "description": "References to evidence supporting the provenance claim. May be empty.",
          "default": [],
          "items": { "$ref": "#/$defs/EvidenceRef" }
        },
        "known_limitations": {
          "type": ["string", "null"],
          "description": "Known limitations, gaps, or unresolved conditions in the provenance."
        },
        "provenance_status": {
          "$ref": "#/$defs/ProvenanceStatus"
        },
        "submitted_to_gate": {
          "type": "boolean",
          "description": "True when this value is submitted by the Generator in its DeclarationPackage. False for values the gate produces."
        }
      }
    },

    "InputClassification": {
      "type": "string",
      "description": "Classification describing the observational basis of an input. Describes provenance; does not determine whether an operator can execute.",
      "enum": [
        "primary_observable",
        "declared_parameter",
        "derived_value",
        "simulated_input",
        "abstract_input"
      ],
      "enumDescriptions": {
        "primary_observable": "An input supported by an identified observational acquisition process.",
        "declared_parameter": "A value supplied as a declared configuration or reference.",
        "derived_value": "A value produced through an identified transformation. The gate produces this; the Generator does not submit it.",
        "simulated_input": "A value generated within a declared simulation or test fixture.",
        "abstract_input": "A conceptual or stipulated value without a demonstrated observational basis."
      }
    },

    "ProvenanceStatus": {
      "type": "string",
      "description": "Claim about the degree of independent support for a provenance assertion.",
      "enum": ["declared", "verified", "unverified"],
      "enumDescriptions": {
        "declared": "The source and history asserted by the submitting party. Not independently verified.",
        "verified": "The portion of the history supported by evidence actually evaluated. Requires non-empty supporting_evidence.",
        "unverified": "The claim could not be independently verified."
      }
    },

    "EvidenceRef": {
      "type": "object",
      "description": "A reference to external evidence supporting a provenance claim.",
      "required": ["id", "description", "kind"],
      "additionalProperties": false,
      "properties": {
        "id": {
          "type": "string",
          "description": "Short identifier for this evidence, e.g. 'cal-2024-03'.",
          "minLength": 1
        },
        "description": {
          "type": "string",
          "description": "Human-readable description of what this evidence is and how it supports the claim.",
          "minLength": 1
        },
        "kind": {
          "type": "string",
          "description": "Kind of evidence: 'calibration', 'specification', 'test_result', 'measurement_log', 'design_document', or similar.",
          "minLength": 1
        }
      }
    },

    "RegionalPrerequisiteDecl": {
      "type": "object",
      "description": "The four required fields of the Regional M prerequisite. No defaults: every field must be explicitly supplied.",
      "required": [
        "region_name",
        "extents_lower",
        "extents_upper",
        "extents_label",
        "orientation_preserved",
        "orientation_discarded",
        "admission_rule_name",
        "admission_rule_description",
        "interior_locus_verified"
      ],
      "additionalProperties": false,
      "properties": {
        "region_name": {
          "type": "string",
          "description": "Region name matching the topology ID declared in the gate.",
          "minLength": 1
        },
        "extents_lower": {
          "type": "number",
          "description": "Lower bound of the observable extent (exclusive)."
        },
        "extents_upper": {
          "type": "number",
          "description": "Upper bound of the observable extent (exclusive)."
        },
        "extents_label": {
          "type": "string",
          "description": "Label for the extent unit, e.g. 'phase_fraction'.",
          "minLength": 1
        },
        "orientation_preserved": {
          "type": "string",
          "description": "What the authorized mapping preserves across the family boundary.",
          "minLength": 1
        },
        "orientation_discarded": {
          "type": "string",
          "description": "What the authorized mapping discards.",
          "minLength": 1
        },
        "admission_rule_name": {
          "type": "string",
          "description": "Short identifier for the regional admission rule.",
          "minLength": 1
        },
        "admission_rule_description": {
          "type": "string",
          "description": "Plain-language description of the admission rule.",
          "minLength": 1
        },
        "interior_locus_verified": {
          "type": "boolean",
          "description": "True when the domain builder has called establish(locus) with a verified interior point."
        }
      }
    },

    "MappingDeclaration": {
      "type": "object",
      "description": "Declaration of one authorized mapping.",
      "required": ["name", "input_description", "output_description", "preserves", "discards"],
      "additionalProperties": false,
      "properties": {
        "name": {
          "type": "string",
          "description": "Name matching the AuthorizedMapping registered in the gate.",
          "minLength": 1
        },
        "input_description": {
          "type": "string",
          "description": "Description of the inputs this mapping receives.",
          "minLength": 1
        },
        "output_description": {
          "type": "string",
          "description": "Description of the value this mapping produces.",
          "minLength": 1
        },
        "preserves": {
          "type": "string",
          "description": "What relational structure is preserved across the mapping.",
          "minLength": 1
        },
        "discards": {
          "type": "string",
          "description": "What is intentionally discarded.",
          "minLength": 1
        }
      }
    }
  }
}
